{
  "schema": "ao.atlas.schema-validator-drift.v0.1",
  "status": "recorded_no_unexpected_loss",
  "source_report_path": "docs/evidence/ao-atlas-feature-depth-followup-durability-v03/nodes/mission-recommendation-feature-depth-next-wave-05/feature-depth-evidence-validation-report.json",
  "target_report_path": "docs/evidence/ao-atlas-feature-depth-followup-durability-v03/nodes/mission-recommendation-feature-depth-next-wave-07/feature-depth-evidence-validation-report.json",
  "source_report_digest": "sha256:e41ac88c0b274602ce69b4e63c484c072f8c71d4a2c4522604471a0afd13f2cf",
  "target_report_digest": "sha256:b36b97e3d02768e84c1cb6a4254d1438ec95623af7b6424bbf9b2af459d7e0e1",
  "source_node_count": 5,
  "target_node_count": 7,
  "json_file_delta": 40,
  "typed_validator_delta": 25,
  "generic_schema_delta": 15,
  "schema_count_deltas": {
    "ao.atlas.candidate-record.v0.1": 2,
    "ao.atlas.checkpoint-bundle.v0.1": 2,
    "ao.atlas.command-readback.v0.1": 2,
    "ao.atlas.factory-task.v0.1": 2,
    "ao.atlas.foundry-continuation-handoff.v0.1": 2,
    "ao.atlas.foundry-import.v0.1": 2,
    "ao.atlas.implementation-evidence.v0.1": 2,
    "ao.atlas.long-recommendation-wave-execution.v0.3": 2,
    "ao.atlas.mission-operator-summary-check.v0.1": 0,
    "ao.atlas.mission-readback-delta.v0.1": 2,
    "ao.atlas.mission-readback-diff-fixture.v0.1": 0,
    "ao.atlas.mission-stale-checkpoint-rejection.v0.1": 0,
    "ao.atlas.node-gate.v0.1": 2,
    "ao.atlas.promoter-no-promotion.v0.1": 2,
    "ao.atlas.recommendation-checkpoint-readback.v0.1": 2,
    "ao.atlas.recommendation-evidence-validation-report.v0.1": 1,
    "ao.atlas.recommendation-readback.v0.1": 2,
    "ao.atlas.rollback-record.v0.1": 2,
    "ao.atlas.run-link-schema-coverage.v0.1": 1,
    "ao.atlas.run-link.v0.1": 2,
    "ao.atlas.sentinel-public-safety.v0.1": 2,
    "ao.atlas.tests-evidence.v0.1": 2,
    "ao.atlas.verification-evidence.v0.1": 2,
    "ao.atlas.workgraph.v0.1": 2
  },
  "validator_count_deltas": {
    "generic:schema-marker": 15,
    "typed:command-readback": 2,
    "typed:factory-task": 2,
    "typed:foundry-continuation-handoff": 2,
    "typed:foundry-import": 2,
    "typed:mission-operator-summary-check": 0,
    "typed:mission-readback-delta": 2,
    "typed:mission-readback-diff-fixture": 0,
    "typed:mission-stale-checkpoint-rejection": 0,
    "typed:promoter-no-promotion": 2,
    "typed:recommendation-checkpoint-readback": 2,
    "typed:recommendation-execution-readback": 2,
    "typed:recommendation-readback": 2,
    "typed:run-link": 2,
    "typed:run-link-schema-coverage": 1,
    "typed:sentinel-public-safety": 2,
    "typed:workgraph": 2
  },
  "added_schemas": [
    "ao.atlas.recommendation-evidence-validation-report.v0.1",
    "ao.atlas.run-link-schema-coverage.v0.1"
  ],
  "lost_schemas": [],
  "added_validators": [
    "typed:run-link-schema-coverage"
  ],
  "lost_validators": [],
  "unexpected_loss_detected": false,
  "schedules_work": false,
  "executes_work": false,
  "approves_work": false,
  "claims_authority_advance": false,
  "rsi_remains_denied": true
}
